,code,name,regn,lutn,zea,lycpn,crypxb,cartg,carta,cartb,cartoid
0,A001,"Amaranth seed, black (Amaranthus cruentus)",1,10.25,0,0,0,0,0,0,121
1,A002,"Amaranth seed, pale brown (Amaranthus cruentus)",6,4.11,0,0,0,0,0,0,59.68
2,A003,Bajra (Pennisetum typhoideum),6,29.69,9.30,0,0,0,0,28.23,293
3,A004,Barley (Hordeum vulgare),6,5.39,1.90,0,0,0,0,0,69.87
4,A005,Jowar (Sorghum vulgare),6,9.08,7.48,0,0,0,0,8.29,212
5,A006,"Maize, dry (Zea mays)",6,186,42.4,0,110,0,0,186,893
6,A007,"Maize, tender, local (Zea mays)",6,110,26.53,0,37.26,0,0,36.27,1428
7,A008,"Maize, tender, sweet (Zea mays)",4,108,28.19,0,58.41,0,0,47.01,1035
8,A009,Quinoa (Chenopodium quinoa),1,11.88,10.05,0,0,0,0,5.12,153
9,A010,Ragi (Eleusine coracana),5,25.53,1.45,0,0,0,0,1.53,154
10,A011,Rice flakes (Oryza sativa ),6,1.46,0,0,0,0,0,0,33.61
11,A012,Rice puffed (Oryza sativa ),6,1.51,0,0,0,0,0,0,50.46
12,A013,"Rice, raw, brown (Oryza sativa )",6,13.15,0,0,0,0,0,0,159
13,A014,"Rice, parboiled, milled (Oryza sativa )",6,1.46,0,0,0,0,0,0,46.90
14,A015,"Rice, raw, milled (Oryza sativa )",6,1.49,0,0,0,0,0,0,16.87
15,A016,Samai (Panicum miliare),6,7.82,5.24,0,0,0,0,1.91,120
16,A017,Varagu (Setaria italica),5,59.40,3.91,0,0,0,0,1.41,272
17,A018,"Wheat flour, refined (Triticum aestivum)",6,24.41,1.30,0,0,0,0,1.97,270
18,A019,"Wheat flour, atta (Triticum aestivum)",6,42.12,1.31,0,0,0,0,2.67,284
19,A020,"Wheat, whole (Triticum aestivum)",6,52.56,1.47,0,0,0,0,3.03,287
20,A021,"Wheat, bulgur (Triticum aestivum)",6,47.67,1.06,0,0,0,0,2.55,191
21,A022,"Wheat, semolina (Triticum aestivum)",6,29.94,1.13,0,0,0,0,1.60,276
22,A023,"Wheat, vermicelli (Triticum aestivum)",6,19.31,0.89,0,0,0,0,1.68,39.54
23,A024,"Wheat, vermicelli, roasted (Triticum aestivum)",6,12.89,1.08,0,0,0,0,0.92,21.33
24,B001 ,"Bengal gram, dal (Cicer arietinum) ",6,314 ,1.05 ,0,0,0,0,165 ,1018
25,B002,"Bengal gram, whole (Cicer arietinum)",6,385,24.74,0,0,0,0,172,999
26,B003,"Black gram, dal (Phaseolus mungo)",6,83.87,0,0,0,0,0,10.11,279
27,B004,"Black gram, whole (Phaseolus mungo)",6,95.42,0,0,0,0,0,12.80,463
28,B005,"Cowpea, brown (Vigna catjang)",6,83.34,0,0,0,0,0,7.08,218
29,B006,"Cowpea, white (Vigna catjang)",1,78.52,0,0,0,0,0,8.21,250
30,B007,"Field bean, black (Phaseolus vulgaris)",1,48.99,0,0,0,0,0,0,207
31,B008,"Field bean, brown (Phaseolus vulgaris)",1,53.18,0,0,0,0,0,0,254
32,B009,"Field bean, white (Phaseolus vulgaris)",5,58.47,0,0,0,0,0,0,256
33,B010,"Green gram, dal (Phaseolus aureus)",6,113,2.98,0,0,0,0,122,619
34,B011,"Green gram, whole (Phaseolus aureus)",6,187,5.63,0,0,0,0,137,889
35,B012,"Horse gram, whole (Dolicus biflorus)",6,67.26,2.92,0,0,0,0,58.57,267
36,B013,Lentil dal (Lens culinaris),6,5.92,0,0,0,0,0,6.34,812
37,B014,"Lentil whole, brown (Lens culinaris)",6,6.85,0,0,0,0,0,10.29,924
38,B015,"Lentil whole, yellowish (Lens culinaris)",2,7.76,0,0,0,0,0,12.64,939
39,B016,Moth bean (Vigna aconitifolia),6,148,0,0,0,0,0,3.57,622
40,B017,"Peas, dry (Pisum sativum)",6,474,23.41,0,0,0,0,65.71,933
41,B018,"Rajmah, black (Phaseolus vulgaris)",2,6.38,0,0,0,0,0,1.95,86.67
42,B019,"Rajmah, brown (Phaseolus vulgaris)",6,7.18,0,0,0,0,0,2.16,90.26
43,B020,"Rajmah, red (Phaseolus vulgaris)",3,6.76,0,0,0,0,0,1.60,103
44,B021,"Red gram, dal (Cajanus cajan)",6,11.69,0,0,0,0,0,127,484
45,B022,"Red gram, whole (Cajanus cajan)",6,25.25,0,0,0,0,0,149,579
46,B023,Ricebean (Vigna umbellata ),1,6.88,0,0,0,0,0,0,29.02
47,B024,"Soya bean, brown (Glycine max)",6,35.47,0,0,0,0,0,3.50,262
48,B025,"Soya bean, white (Glycine max)",1,28.5,0,0,0,0,0,2.82,282
49,C001,Agathi leaves (Sesbania grandiflora),1,12941,559,0,0,0,0,12582,36087
50,C002,"Amaranth leaves, green (Amaranthus gangeticus)",6,8397,164,0,0,0,0,8553,20473
51,C003,"Amaranth leaves, red (Amaranthus gangeticus)",1,7439,118,0,0,0,0,8457,21449
52,C004,"Amaranth leaves, red and green (Amaranthus gangeticus)",4,7390,148,0,0,0,0,8464,20181
53,C005,"Amaranth spinosus, leaves, green (Amaranthus spinosus)",4,1861,126,0,0,0,0,1594,4174
54,C006,"Amaranth spinosus, leaves, red and green (Amaranthus spinosus)",2,1748,160,0,0,0,0,1487,4540
55,C007,Basella leaves (Basella alba),2,2962,241,0,0,0,0,2473,5824
56,C008,Bathua leaves (Chenopodium album),2,1795,132,0,0,0,0,1075,3469
57,C009,Beet greens (Beta vulgaris),6,1495,146,0,0,0,0,1703,3340.97
58,C010,"Betel leaves, big (kolkata) (Piper betle)",6,4253,60.31,0,0,0,191,4186,13735
59,C011,"Betel leaves, small (Piper betle)",4,5783,79.80,0,0,0,427,4676,16563
60,C012,Brussels sprouts (Brassica oleracea var. gemmifera),1,1653,35.64,0,0,0,0,360,2564
61,C013,"Cabbage, Chinese (Brassica rupa)",1,58,1.5,0,0,0,0,5.5,103
62,C014,"Cabbage, collard greens (Brassica oleracea var. viridis)",1,143,2.68,0,0,0,0,104,358
63,C015,"Cabbage, green (Brassica oleracea var. capitata f. alba)",6,3.98,0,0,0,0,0,20.48,273
64,C016,"Cabbage, violet (Brassica oleracea var. capitata f. rubra)",2,44.5,2.2,0,0,0,0,31.17,339
65,C017,Cauliflower leaves (Brassica oleracea var. botrytis),6,152,1.97,0,0,0,0,146,1742
66,C018,"Colocasia leaves, green (Colocasia anti-quorum)",6,5222,136,0,0,0,0,5758,26820
67,C019,Drumstick leaves (Moringa oleifera),3,15580,235,0,0,0,0,17542,38765
68,C020,Fenugreek leaves (Trigonella foenum graecum),5,2275,28.28,0,0,0,0,9245,12755
69,C021,Garden cress (Lepidium sativum),2,1354,16.63,0,0,0,0,88.72,5048
70,C022,"Gogu leaves, green (Hibiscus cannabinus)",4,5276,18.72,0,0,0,0,5285,16088
71,C023,"Gogu leaves, red (Hibiscus cannabinus)",1,4782,20.5,0,0,0,0,5143,15934
72,C024,"Knol-Khol, leaves (Brassica oleracea var. gongylodes)",2,15.62,2.77,0,0,0,0,12.04,154
73,C025,Lettuce (Lactuca sativa),3,1858,5.64,0,0,0,0,1285,7532
74,C026,Mustard leaves (Brassica juncea),3,2939,8.13,0,0,0,0,2619,6397
75,C027,Pak Choi leaves (Brassica rapa var. Chinensis),1,2655,5.5,0,0,0,0,2450,5111
76,C028,Parsley (Petroselinum crispum),3,3574,11.92,0,0,0,0,2710,6558
77,C029,Ponnaganni (Alternanthera sessilis),2,5201,105,0,0,0,0,5288,24206
78,C030,"Pumpkin leaves, tender (Cucurbita maxima)",6,6139,45.28,0,0,0,0,1455,8247
79,C031,Radish leaves (Raphanus sativus),6,1741,22.71,0,0,0,0,2591,9339
80,C032,Rumex leaves (Rumex patientia),2,2370,18.98,0,0,0,0,2754,8290
81,C033,Spinach (Spinacia oleracea),6,3850,17.23,0,0,0,0,2605,9553
82,C034,"Tamarind leaves, tender (Tamarindus indica)",3,58.83,1.88,0,0,0,0,168,4002
83,D001 ,Ash gourd (Benincasa hispida) ,6,18.29 ,5.76 ,0,0,0,0,0,66.67
84,D002,"Bamboo shoot, tender (Bambusa vulgaris)",1,2.5,0,0,0,0,0,0,11.6
85,D003,"Bean scarlet, tender (Phaseolus coccineus)",5,98.51,2.67,0,0,0,0,35.52,1055
86,D004,"Bitter gourd, jagged, teeth ridges, elongate (Momordica charantia)",6,282,5.83,0,0,0,0,122,717
87,D005,"Bitter gourd, jagged, teeth ridges, short (Momordica charantia)",4,244,6.96,0,0,0,0,126,505
88,D006,"Bitter gourd, jagged, smooth ridges, elongate (Momordica charantia)",1,313,7.2,0,0,0,0,130,481
89,D007,"Bottle gourd, elongate, pale green (Lagenaria vulgaris)",6,28.88,0,0,0,0,0,44.05,95.12
90,D008,"Bottle gourd, round, pale green (Lagenaria vulgaris)",5,29.64,8.60,0,0,0,0,47.13,92.56
91,D009,"Bottle gourd, elongate, dark green (Lagenaria vulgaris)",1,28.98,2.5,0,0,0,0,44.82,97.02
92,D010,Brinjal-1 (Solanum melongena),1,126,1.9,0,0,0,0,126,186
93,D011,Brinjal-2 (Solanum melongena),1,130,2.8,0,0,0,0,130,167
94,D012,Brinjal-3 (Solanum melongena),2,131,3.29,0,0,0,0,138,155
95,D013,Brinjal-4 (Solanum melongena),4,142,3.90,0,0,0,0,140,138
96,D014,Brinjal-5 (Solanum melongena),3,122,2.78,0,0,0,0,123,136
97,D015,Brinjal-6 (Solanum melongena),2,126,4.16,0,0,0,0,129,168
98,D016,Brinjal-7 (Solanum melongena),1,155,4.5,0,0,0,0,155,166
99,D017,Brinjal-8 (Solanum melongena),3,162,3.77,0,0,0,0,162,190
100,D018,Brinjal-9 (Solanum melongena),2,160,2.89,0,0,0,0,158,232
101,D019,Brinjal-10 (Solanum melongena),2,161,2.39,0,0,0,0,161,162
102,D020,Brinjal-11 (Solanum melongena),6,152,2.02,0,0,0,0,162,227
103,D021,Brinjal-12 (Solanum melongena),2,147,2.89,0,0,0,0,144,217
104,D022,Brinjal-13 (Solanum melongena),1,138,3.9,0,0,0,0,138,116
105,D023,Brinjal-14 (Solanum melongena),3,137,4.12,0,0,0,0,134,493
106,D024,Brinjal-15 (Solanum melongena),4,169,4.35,0,0,0,0,162,346
107,D025,Brinjal-16 (Solanum melongena),1,155,1.8,0,0,0,0,155,364
108,D026,Brinjal-17 (Solanum melongena),1,146,1.9,0,0,0,0,146,564
109,D027,Brinjal-18 (Solanum melongena),3,128,2.88,0,0,0,0,130,364
110,D028,Brinjal-19 (Solanum melongena),3,119,3.68,0,0,0,0,119,552
111,D029,Brinjal-20 (Solanum melongena),5,139,4.08,0,0,0,0,139,651
112,D030,Brinjal-21 (Solanum melongena),2,156,4.44,0,0,0,0,155,670
113,D031,Brinjal - all varieties (Solanum melongena),6,144,3.21,0,0,0,0,146,309
114,D032,Broad beans (Vicia faba),3,106,24.25,0,0,0,0,6.38,574
115,D033,"Capsicum, green (Capsicum annuum)",6,164,21.41,0,0,0,0,328,2511
116,D034,"Capsicum, red (Capsicum annuum)",4,165,18.28,0,0,0,0,246,3047
117,D035,"Capsicum, yellow (Capsicum annuum)",4,280,17.95,0,0,0,0,166,2717
118,D036,Cauliflower (Brassica oleracea),6,31.3,5.77,0,0,0,0,1.59,50.48
119,D037,Celery stalk (Apium graveolens),3,161,2.61,0,0,0,0,465,2439
120,D038,Cho-cho-marrow (Sechium edule),4,8.56,1.80,0,0,0,0,1.57,24.53
121,D039,Cluster beans (Cyamopsis tetragonobola),6,538,21.49,0,0,0,0,241,1192
122,D040,"Colocasia, stem, black (Colocasia antiquorum)",1,97.12,5.3,0,0,0,0,4.97,631
123,D041,"Colocasia, stem, green (Colocasia antiquorum)",5,99.6,1.96,0,0,0,0,2.30,597
124,D042,"Corn, Baby (Zea mays)",6,5.79,1.90,0,0,0,0,1.52,72.89
125,D043,"Cucumber, green, elongate (Cucumis sativus)",6,2.22,0,0,0,0,0,5.33,171
126,D044,"Cucumber, green, short (Cucumis sativus)",6,4.86,0,0,0,0,0,4.80,172
127,D045,"Cucumber, orange, round (Cucumis sativus)",2,3.19,0,0,0,0,0,5.55,134
128,D046,Drumstick (Moringa oleifera),6,145,5.52,0,0,0,0,17.28,350
129,D047,"Field beans, tender, broad (Vicia faba)",2,467,21.54,0,0,0,83.48,555,1738
130,D048,"Field beans, tender, lean (Vicia faba)",6,297,2.79,0,0,0,74.32,556,1837
131,D049,"French beans, country (Phaseolus vulgaris)",5,235,21.21,0,0,0,3.57,413,1501
132,D050,"French beans, hybrid (Phaseolus vulgaris)",2,228,13.35,0,0,0,3.18,388,1449
133,D051,"Jack fruit, raw (Artocarpus heterophyllus)",5,4.86,2.92,0,0,0,0,0,17.66
134,D052,"Jack fruit, seed, mature (Artocarpus heterophyllus)",5,2.13,1.56,0,0,0,0,0,19.63
135,D053,Knol - Khol (Brassica oleracea),6,2.51,1.55,0,0,0,0,0,28.82
136,D054,"Kovai, big (Coccinia cordifolia)",6,170,5.74,0,0,0,0,134,498
137,D055,"Kovai, small (Coccinia cordifolia)",1,157,4.5,0,0,0,0,147,586
138,D056,Ladies finger (Abelmoschus esculentus),6,798,3.53,0,0,0,0,69.10,1223
139,D057,"Mango, green, raw (Mangifera indica)",6,122,1.52,0,11.94,0,0,72.37,517
140,D058,"Onion, stalk (Allium cepa)",6,575,2.43,0,0,0,0,700,3488
141,D059,"Papaya, raw (Carica papaya)",6,266,7.88,0,76.80,0,0,164,548
142,D060,Parwar (Trichosanthes dioica),6,322,10.77,0,0,0,0,13.10,965
143,D061,"Peas, fresh (Pisum sativum)",6,68.6,11.40,0,0,0,0,121,1286
144,D062,"Plantain, flower (Musa x paradisiaca)",6,75.7,5.90,0,0,0,0,35.36,149
145,D063,"Plantain, green (Musa x paradisiaca)",6,28.9,3.45,0,0,0,0,3.01,224
146,D064,"Plantain, stem (Musa x paradisiaca)",6,26.3,3.68,0,0,0,0,2.39,69.31
147,D065,"Pumpkin, green, cylindrical (Cucurbita maxima)",1,394,26.6,0,0,0,63.91,363,1319
148,D066,"Pumpkin, orange, round (Cucurbita maxima)",6,161,34.91,0,0,0,90.74,149,1449
149,D067,"Red gram, tender, fresh (Cajanus cajan)",1,190,0,0,0,0,0,165,495
150,D068,Ridge gourd (Luffa acutangula),6,129,19.50,0,0,0,0,348,838
151,D069,"Ridge gourd, smooth skin (Luffa acutangula)",3,127,18.83,0,0,0,0,349,851
152,D070,"Snake gourd, long, pale green (Trichosanthes anguina)",6,38.9,3.67,0,0,0,0,61.29,190
153,D071,"Snake gourd, long, dark green (Trichosanthes anguina)",2,39.6,5.41,0,0,0,0,61.64,188
154,D072,"Snake gourd, short (Trichosanthes anguina)",1,32.75,4.5,0,0,0,0,62.84,188
155,D073,"Tinda, tender (Praecitrullus fistulosus)",6,8.19,2.22,0,0,0,0,7.96,49.81
156,D074,"Tomato, green (Lycopersicon esculentum)",6,38.9,2.48,35.97,0,5.80,0,32.33,546
157,D075,"Tomato, ripe, hybrid (Lycopersicon esculentum)",6,1568,10.96,2481,0,7.32,0,1513,5826
158,D076,"Tomato, ripe, local (Lycopersicon esculentum)",6,965,17.52,1736,0,9.37,0,905,4656
159,D077,"Zucchini, green (Cucurbita pepo)",2,87.86,16.23,0,0,0,0,85.79,963
160,D078,"Zucchini, yellow (Cucurbita pepo)",2,294,25.6,0,0,0,0,69.9,1177
161,E001 ,"Apple, big (Malus domestica) ",6,36.4,1.90 ,0,0,0,0,2.41 ,229
162,E002,"Apple, green (Malus domestica)",6,40.2,1.91,0,0,0,0,2.20,196
163,E003,"Apple, small (Malus domestica)",6,38.8,1.71,0,0,0,0,2.08,198
164,E004,"Apple, small, Kashmir (Malus domestica)",1,46.26,1.98,0,0,0,0,2.11,344
165,E005,"Apricot, dried (Prunus armeniaca)",6,4.98,2.33,0,0,0,0,1806,4313
166,E006,"Apricot, processed (Prunus armeniaca)",3,3.07,1.98,0,0,0,0,1372,3357
167,E007,Avocado fruit (Persea americana),1,25.13,2.5,0,0,0,0,12,321
168,E008,Bael fruit (Aegle marmelos),1,36.12,2.2,0,0,0,0,2.5,172
169,E009,"Banana, ripe, montham (Musa x paradisiaca)",1,47.32,1.9,0,0,0,3.57,53.06,260
170,E010,"Banana, ripe, poovam (Musa x paradisiaca)",2,34.67,2.75,0,0,0,1.71,57.33,252
171,E011,"Banana, ripe, red (Musa x paradisiaca)",1,47.08,2.5,0,0,0,2.12,51.52,261
172,E012,"Banana, ripe, robusta (Musa x paradisiaca)",6,26.9,2.33,0,0,0,3.57,56.78,314
173,E013,Black berry (Rubus fruticosus),5,105,2.37,0,0,0,0,52.32,166
174,E014,"Cherries, red (Prunus cerasus)",4,92.9,5.69,0,0,0,0,40.78,259
175,E015,"Currants, black (Ribes nigrum)",1,242,12.9,0,0,0,0,62.48,453
176,E016,Custard apple (Annona squamosa),1,12.45,1.8,0,0,0,0,0,142
177,E017,"Dates, dry, pale brown (Phoenix dactylifera)",6,281,8.95,0,0,0,0,2700,3483
178,E018,"Dates, dry, dark brown (Phoenix dactylifera)",2,285,4.83,0,0,0,0,2705,3280
179,E019,"Dates, processed (Phoenix dactylifera)",2,305,86.34,0,0,0,0,2781,3288
180,E020,Fig (Ficus carica),6,19.0,2.01,0,0,0,0,2.40,454
181,E021,Goosberry (Emblica officinalis),5,38.7,2.86,0,0,0,0,1.58,62.01
182,E022,"Grapes, seeded, round, black (Vitis vinifera)",4,27.8,3.59,0,0,0,0,29.36,213
183,E023,"Grapes, seeded, round, green (Vitis vinifera)",5,31.3,4.06,0,0,0,0,30.77,208
184,E024,"Grapes, seeded, round, red (Vitis vinifera)",5,17.2,7.58,0,0,0,0,19.94,314
185,E025,"Grapes, seedless, oval, black (Vitis vinifera)",5,19.4,8.14,0,0,0,0,19.73,321
186,E026,"Grapes, seedless, round, green (Vitis vinifera)",5,25.8,6.82,0,0,0,0,25.46,216
187,E027,"Grapes, seedless, round, black (Vitis vinifera)",5,16.1,7.95,0,0,0,0,20.58,232
188,E028,"Guava, white flesh (Psidium guajava)",5,19.7,5.92,0,0,0,0,298,996
189,E029,"Guava, pink flesh (Psidium guajava)",5,90.3,8.94,2843,0,0,0,267,4078
190,E030,"Jack fruit, ripe (Artocarpus heterophyllus)",5,19.3,2.42,0,0,0,0,23.53,59.61
191,E031,"Jambu fruit, ripe (Syzygium cumini)",2,18.49,5.68,0,0,0,0,1.55,66.5
192,E032,Karonda fruit (Carissa carandas),1,6.12,1.14,0,0,0,0,15.64,55.89
193,E033,"Lemon, juice (Citrus limon)",6,9.68,1.72,0,0,0,0,2.62,85.99
194,E034,"Lime, sweet,pulp (Citrus limetta)",6,13.2,1.89,0,0,0,0,2.54,85.13
195,E035,Litchi (Nephelium litchi),4,27.33,1.61,0,0,0,0,1.47,129
196,E036,"Mango, ripe, banganapalli (Mangifera indica)",6,3.19,1.62,0,2.72,0,0,1168,1424
197,E037,"Mango, ripe, gulabkhas (Mangifera indica)",2,4.18,1.64,0,4.58,0,0,666,1350
198,E038,"Mango, ripe, himsagar (Mangifera indica)",3,6.26,1.19,0,5.60,0,0,1181,1423
199,E039,"Mango, ripe, kesar (Mangifera indica)",4,3.71,2.33,0,6.96,0,0,1264,1438
200,E040,"Mango, ripe, neelam (Mangifera indica)",2,2.95,1.67,0,2.51,0,0,1291,1376
201,E041,"Mango, ripe, paheri (Mangifera indica)",2,2.51,7.19,0,2.49,0,0,1061,1210
202,E042,"Mango, ripe, totapari (Mangifera indica)",1,13.27,2.86,0,4.56,0,0,602,1632
203,E043,Mangosteen (Garcinia mangostana),1,16.81,5.4,0,0,0,0,1.8,181
204,E044,Manila tamarind (Pithecellobium dulce),1,36.5,10.5,0,0,0,0,2.2,154
205,E045,"Musk melon, orange flesh (Cucumis melon)",5,20.17,2.52,0,0,0,0,771,925
206,E046,"Musk melon, yellow flesh (Cucumis melon)",6,22.48,2.69,0,0,0,0,6.87,92.15
207,E047,"Orange, pulp (Citrus aurantium)",6,13.8,31.88,0,44.02,0,5.76,31.94,675
208,E048,"Palm fruit, tender (Borassus flabellifer)",1,5.8,1.5,0,0,0,0,0,50
209,E049,"Papaya, ripe (Carcia papaya)",6,5.43,280,833,648,0,0,694,2472
210,E050,Peach (Prunus communis),1,5.8,1.5,0,0,0,0,0,50
211,E051,Pear (Pyrus sp.),6,14.7,2.77,0,1.44,0,0,13.16,92.30
212,E052,Phalsa (Grewia asiatica),2,157,3.11,0,0,0,5.68,1.71,396
213,E053,Pineapple (Ananas comosus),6,8.11,1.80,0,0,0,0,31.21,86.31
214,E054,Plum (Prunus domestica),3,5.67,2.39,0,0,0,0,1.32,430
215,E055,"Pomegranate, maroon seeds (Punica granatum)",6,27.8,2.51,0,0,0,0,2.05,47.28
216,E056,Pummelo (Citrus maxima),3,22.5,5.90,0,10.43,0,0,1.55,337
217,E057,"Raisins, dried, black (Vitis vinifera)",6,9.13,2.18,0,0,0,0,3.71,207
218,E058,"Raisins, dried, golden (Vitis vinifera)",6,28.3,3.53,0,0,0,0,2.53,272
219,E059,Rambutan (Nephelium lappaceum),1,16.8,2.5,0,0,0,0,2.9,175
220,E060,Sapota (Achras sapota),6,22.6,2.09,0,0,0,0,80.70,229
221,E061,Soursop ( Annona muricata ),1,29.8,5.3,0,0,0,0,2.2,78
222,E062,Star fruit (Averrhoa carambola),1,26.8,2.6,0,0,0,0,1.4,152
223,E063,Strawberry (Fragaria ananassa),6,19.3,1.45,0,0,0,0,2.19,218
224,E064,"Tamarind, pulp (Tamarindus indicus)",6,28.4,11.61,0,0,0,0,1.54,188
225,E065,"Water melon, dark green (sugar baby) (Citrullus vulgaris)",6,914,25.95,1477,0,0,0,605,4176
226,E066,"Water melon, pale green (Citrullus vulgaris)",6,981,23.40,1257,0,0,0,576,4300
227,E067,Wood Apple (Limonia acidissima),3,11.0,2.57,0,0,0,0,3.81,77.06
228,E068,Zizyphus (Zizyphus jujube),1,10.7,1.6,0,0,0,0,1.5,76.8
229,F001 ,Beet root (Beta vulgaris) ,6,28.6 ,4.57 ,0,0,0,0,10.14 ,12.88
230,F002,"Carrot, orange (Dacus carota)",6,257,13.93,157,0,0,2654,5423,9377
231,F003,"Carrot, red (Dacus carota)",4,224,15.49,871,0,0,1128,2706,7570
232,F004,Colocasia (Colocasia antiquorum),6,5.87,2.07,0,0,0,0,6.50,21.72
233,F005,Lotus root (Nelumbium nelumbo),3,13.0,0,0,0,0,0,0,156
234,F006,"Potato, brown skin, big (Solanum tuberosum)",6,8.07,122,0,0,0,0,0,208
235,F007,"Potato, brown skin, small (Solanum tuberosum)",1,7.86,125,0,0,0,0,0,224
236,F008,"Potato, red skin (Solanum tuberosum)",1,8.12,123,0,0,0,0,0,226
237,F009,"Radish, elongate, red skin (Raphanus sativus)",3,8.68,2.38,0,0,0,0,1.62,17.61
238,F010,"Radish, elongate, white skin (Raphanus sativus)",6,5.34,2.08,0,0,0,0,0,10.60
239,F011,"Radish, round, red skin (Raphanus sativus)",1,7.8,2.5,0,0,0,0,1.2,13.07
240,F012,"Radish, round, white skin (Raphanus sativus)",2,6.36,1.66,0,0,0,0,0,23.69
241,F013,"Sweet potato, brown skin (Ipomoes batatas)",4,282,146,0,0,0,0,5376,8653
242,F014,"Sweet potato, pink skin (Ipomoes batatas)",3,208,133,0,0,0,0,11.12,95.93
243,F015,Tapioca (Manihot esculenta),3,5.93,2.38,0,0,0,0,0,60.90
244,F016,Water Chestnut (Eleocharis dulcis),1,8.12,2.5,0,0,0,0,0,93.08
245,F017,"Yam, elephant (Amorphophallus campanulatus)",6,168,10.43,0,0,0,32.32,176,599
246,F018,"Yam, ordinary (Amorphophallus campanulatus)",4,273,8.69,0,0,0,0,158,51.04
247,F019,"Yam, wild (Dioscorea versicolor)",2,11.39,1.2,0,0,0,8.95,230,94.53
248,G001,"Chillies, green-1 (Capsicum annum)",5,255,18.92,0,0,0,0,31.69,1135
249,G002,"Chillies, green-2 (Capsicum annum)",3,283,24.48,0,0,0,0,232,1336
250,G003,"Chillies, green-3 (Capsicum annum)",5,285,34.74,0,0,0,0,158,1107
251,G004,"Chillies, green-4 (Capsicum annum)",3,207,45.64,0,0,0,0,67.84,1761
252,G005,"Chillies, green-5 (Capsicum annum)",2,278,41.40,0,0,0,0,45.41,1539
253,G006,"Chillies, green-6 (Capsicum annum)",1,234,35.5,0,0,0,0,508,1478
254,G007,"Chillies, green-7 (Capsicum annum)",1,294,28.5,0,0,0,0,44,1891
255,G008,"Chillies, green - all varieties (Capsicum annum)",6,261,31.47,0,0,0,0,125,1347
256,G009,Coriander leaves (Coriandrum sativum),6,6351,28.30,0,0,0,0,3808,13808
257,G010,Curry leaves (Murraya koenigii),6,2945,36.13,0,0,0,144,7663,21862
258,G011,"Garlic, big clove (Allium sativum)",6,4.02,1.55,0,0,0,0,0,33.91
259,G012,"Garlic, small clove (Allium sativum)",3,5.09,1.57,0,0,0,0,0,30.48
260,G013,"Garlic, single clove, Kashmir (Allium sativum)",1,2.52,1.36,0,0,0,0,0,26.58
261,G014,"Ginger, fresh (Zinziber officinale)",6,15.0,5.97,0,0,0,0,88.85,329
262,G015,Mango ginger (Curcuma amada),3,23.6,3.09,0,0,0,0,76.62,250
263,G016,Mint leaves (Mentha spicata ),4,2526,300,0,0,0,0,4602,18693
264,G017,"Onion, big (Allium cepa)",6,1.77,1.81,0,0,0,0,1.08,89.10
265,G018,"Onion, small (Allium cepa)",5,15.3,1.69,0,0,0,0,1.10,31.04
266,G019,Asafoetida (Ferula assa-foetida),6,23.8,1.52,0,0,0,0,6.42,168
267,G020,"Cardamom, green (Elettaria cardamomum)",6,37.0,32.85,0,0,0,0,21.91,366
268,G021,"Cardamom, black (Elettaria cardamomum)",4,56.9,10.31,0,0,0,0,77.48,1137
269,G022,"Chillies, red (Capsicum annum)",6,1843,2712,36.44,1599,0,0,1542,101812
270,G023,Cloves (Syzygium aromaticum),6,16.9,1.55,0,0,0,8.55,73.51,356
271,G024,Coriander seeds (Coriandrum sativum),6,225,10.96,0,0,0,0,122,996
272,G025,Cumin seeds (Cuminum cyminum),6,170,42.60,0,0,0,0,89.19,553
273,G026,Fenugreek seeds (Trigonella foenum graecum),6,586,201,0,0,0,0,142,1210
274,G027,Mace (Myristica fragrans),6,135,196,0,0,0,0,2322,9203
275,G028,Nutmeg (Myristica fragrans),6,4.01,1.33,0,0,0,0,15.37,80.91
276,G029,Omum (Trachyspermum ammi),6,494,8.30,0,51.37,0,0,746,1836
277,G030,Pippali (Piper longum),6,666,479,0,110,0,278,545,2401
278,G031,"Pepper, black (Piper nigrum)",6,650,158,0,165,0,157,767,2219
279,G032,Poppy seeds (Papaver somniferum),6,23.5,1.76,0,0,0,0,3.51,34.45
280,G033,Turmeric powder (Curcuma domestica),6,99.8,3.56,0,0,0,0,55.20,427
281,H001,Almond (Prunus amygdalus),6,5.93,1.79,0,0,0,0,0,11.31
282,H002,"Arecanut, dried, brown (Areca catechu)",6,21.3,3.83,0,0,0,0,0,41.96
283,H003,"Arecanut, dried, red color (Areca catechu)",3,27.5,3.12,0,0,0,0,0,63.72
284,H004,"Arecanut, fresh (Areca catechu)",2,31.65,6.23,0,0,0,0,0,47.78
285,H005,Cashew nut (Anacardium occidentale),6,5.87,3.21,0,0,0,0,0,16.94
286,H006,"Coconut, kernal, dry (Cocos nucifera)",6,62.5,3.12,0,0,0,0,0,176
287,H007,"Coconut, kernel, fresh (Cocos nucifera)",6,122,4.84,0,0,0,0,2.66,204
288,H008,"Garden cress, seeds (Lepidium sativum)",5,22.5,33.93,0,0,0,0,0,559
289,H009,"Gingelly seeds, black (Sesamum indicum)",6,22.9,2.67,0,0,0,0,13.09,60.78
290,H010,"Gingelly seeds, brown (Sesamum indicum)",4,17.0,2.40,0,0,0,0,5.41,86.72
291,H011,"Gingelly seeds, white (Sesamum indicum)",5,19.7,1.88,0,0,0,0,12.94,57.06
292,H012,Ground nut (Arachis hypogea),6,4.42,8.07,0,0,0,0,22.75,82.80
293,H013,Mustard seeds (Brassica juncea),6,192,6.54,0,0,0,0,36.72,675
294,H014,Linseeds (Linum usitatissimum),6,5.67,7.22,0,0,0,0,1.05,92
295,H015,"Niger seeds, black (Guizotia abyssinica)",4,22.1,9.61,0,0,0,0,2.15,295
296,H016,"Niger seeds, gray (Guizotia abyssinica)",5,6.00,2.38,0,2.73,0,0,8.49,187
297,H017,Pine seed (Pinus gerardiana),5,97.0,11.55,0,0,0,0,1.98,297
298,H018,Pistachio nuts (Pistacla vera),6,171,0,0,0,0,0,110,519
299,H019,Safflower seeds (Carthamus tinctorius),5,27.6,11.04,0,0,0,0,2.07,142
300,H020,Sunflower seeds (Helianthus annuus),5,20.0,2.48,0,0,0,0,8.15,249
301,H021,Walnut (Juglans regia),6,21.7,2.30,0,4.94,0,0,9.53,122
302,I001,"Jaggery, cane (Saccharum officinarum)",6,5.90,0,0,0,0,0,0,18.49
303,I002,"Sugarcane, juice (Saccharum officinarum)",6,8.36,0,0,0,0,0,7.87,41.23
304,J001 ,"Button mushroom, fresh (Agaricus sp.) ",1,0,0,0,0,0,0,0,0
305,J002,"Chicken mushroom, fresh (Lactiporus sp.)",1,0,0,0,0,0,0,0,0
306,J003,"Shiitake mushroom, fresh (Lentinula sp.)",1,0,0,0,0,0,0,0,0
307,J004,"Oyster mushroom, dried (Pleurotus sp.)",1,0,0,0,0,0,0,0,0
308,K001 ,Toddy ,10,0,0,0,0,0,0,0,0
309,K002,Coconut Water,6,4.53,0,0,0,0,0,0,46.12
310,L001 ,"Milk, whole, Buffalo ",6,8.78 ,0,0,0,0,0,8.42 ,80.87
311,L002,"Milk, whole, Cow",6,9.62,5.01,0,0,0,0,13.67,200
312,L003,Paneer,6,7.58,0,0,0,0,0,4.39,194
313,L004,Khoa,6,2.70,0,0,0,0,0,3.52,190
314,M001,"Egg, poultry, whole, raw",6,17.61,37.23,0,0.97,0,0,13.60,135
315,M002,"Egg, poultry, white, raw",6,0,0,0,0,0,0,0,0
316,M003,"Egg, poultry, yolk, raw",6,27.29,56.60,0,2.09,0,0,88.87,241
317,M004,"Egg, poultry, whole, boiled",6,14.69,26.29,0,1.07,0,0,13.19,136
318,M005,"Egg, poultry, white, boiled",6,0,0,0,0,0,0,0,5.30
319,M006,"Egg, poultry, yolk, boiled",6,19.36,54.75,0,1.69,0,0,68.59,218
320,M007,"Egg, poultry, omlet",3,14.47,19.03,0,0.75,0,0,11.36,111
321,M008,"Egg, country hen, whole, raw",1,26.86,47.26,0,1.56,0,0,18.55,191
322,M009,"Egg, country hen, whole, boiled",1,23.61,37.85,0,1.06,0,0,17.45,166
323,M010,"Egg, country hen, omlet",1,20.55,30.85,0,0.95,0,0,14.75,161
324,M011,"Egg, duck, whole, boiled",1,22.21,10.16,0,9.25,0,0,34.59,228
325,M012,"Egg, duck, whole, raw",1,29.5,17.96,0,11.08,0,0,35.66,249
326,M013,"Egg, duck, whole, omlet",1,20.05,9.55,0,8.98,0,0,30.08,213
327,M014,"Egg, quial, whole, raw",1,14.83,28.48,0,3.57,0,0,12.96,242
328,M015,"Egg, quial, whole, boiled",1,12.55,14.75,0,1.86,0,0,10.55,230
